{
  "schema_version": 1,
  "definition_id": "phase1-app-demo-s7",
  "definition_version": 1,
  "title": "Phase 1 App demo evidence criteria (app-demo-plan.md section 7, with the section 6 impostor rows)",
  "purpose": "Machine-readable transcription of the pre-fixed Phase 1 criterion, so that each clause has one evaluator rule and tests. It quotes Phase 1; it does not re-decide Phase 1. Rules and rule tests are PLANNED in WP1.",
  "machine_readable_origin": {
    "phase": "phase2/m1",
    "created_by_work_package": "WP1",
    "committed_in_phase1": false,
    "statement": "This JSON was written in Phase 2 M1 WP1. The criterion text it quotes was committed in Phase 1 (historical_sources); this file was not. Clauses with origin phase2_added are not Phase 1 criteria."
  },
  "historical_sources": [
    {
      "source_id": "app-demo-plan-s7",
      "kind": "pre_fixed_criterion",
      "path": "docs/v2/phase1/app-demo-plan.md",
      "section": "7",
      "coverage": "complete",
      "commit": "24b7a6eae6f6b55813f71e1418bd56f3425019c6",
      "verified_commits": [
        "24b7a6eae6f6b55813f71e1418bd56f3425019c6",
        "c9c2a9e5330533e5ec11dacecff5e0fe72867f71",
        "f00c67f9ffe3dde89d97102b6e791cb5164e3d0f",
        "d8c9b53fbbc7f446bb77d5df315c47b1b3318397",
        "4bd6e015d88b01d34dc83dc2b2d2ffb0058358b2"
      ],
      "blob_ids": {
        "24b7a6eae6f6b55813f71e1418bd56f3425019c6": "002644a9c54a010bf38936212b760a90fad9adf4",
        "c9c2a9e5330533e5ec11dacecff5e0fe72867f71": "1ab033f19cab749c9683b0ec9012d0c4d5eb99a6",
        "f00c67f9ffe3dde89d97102b6e791cb5164e3d0f": "1b4f5b80f43f43e9cfa97ab1abeeecf5e40bcf6a",
        "d8c9b53fbbc7f446bb77d5df315c47b1b3318397": "926a2f9e4a43f7f7f9fc2e7db579085cccfdde12",
        "4bd6e015d88b01d34dc83dc2b2d2ffb0058358b2": "4fe902c64080c6ec9de18c8e3e71629e5c48c8dc"
      },
      "sha256_at_wp0": null,
      "public": true,
      "note": "Section 7 (Evidence), introduced in 24b7a6e (2026-10-27T10:54:44+09:00) and byte-identical in every listed commit through 4bd6e01. The criterion predates the first demo-2 gate run (rev2 C1)."
    },
    {
      "source_id": "app-demo-plan-s6",
      "kind": "pre_fixed_criterion",
      "path": "docs/v2/phase1/app-demo-plan.md",
      "section": "6",
      "coverage": "excerpt",
      "commit": "24b7a6eae6f6b55813f71e1418bd56f3425019c6",
      "verified_commits": [
        "24b7a6eae6f6b55813f71e1418bd56f3425019c6",
        "c9c2a9e5330533e5ec11dacecff5e0fe72867f71",
        "f00c67f9ffe3dde89d97102b6e791cb5164e3d0f",
        "d8c9b53fbbc7f446bb77d5df315c47b1b3318397",
        "4bd6e015d88b01d34dc83dc2b2d2ffb0058358b2"
      ],
      "blob_ids": {
        "24b7a6eae6f6b55813f71e1418bd56f3425019c6": "002644a9c54a010bf38936212b760a90fad9adf4",
        "c9c2a9e5330533e5ec11dacecff5e0fe72867f71": "1ab033f19cab749c9683b0ec9012d0c4d5eb99a6",
        "f00c67f9ffe3dde89d97102b6e791cb5164e3d0f": "1b4f5b80f43f43e9cfa97ab1abeeecf5e40bcf6a",
        "d8c9b53fbbc7f446bb77d5df315c47b1b3318397": "926a2f9e4a43f7f7f9fc2e7db579085cccfdde12",
        "4bd6e015d88b01d34dc83dc2b2d2ffb0058358b2": "4fe902c64080c6ec9de18c8e3e71629e5c48c8dc"
      },
      "sha256_at_wp0": null,
      "public": true,
      "note": "Section 6 (scenarios and expected results, fixed before any run). Only the G3 / G3S / G6 rows are quoted; the rows are identical in every listed commit (the section itself changed elsewhere)."
    },
    {
      "source_id": "p1-rev2-summary",
      "kind": "phase1_decision_record",
      "path": ".agents/tasks/phase1/final-acceptance/rev2/phase1-final-acceptance-summary.md",
      "section": null,
      "coverage": null,
      "commit": null,
      "verified_commits": [],
      "blob_ids": {},
      "sha256_at_wp0": "fabcf5962d0852a1275df5da24797b95e5d0d0fb8a717455e27d9f065a3a7489",
      "public": false,
      "note": "Phase 1 final acceptance rev2 (current). Local, untracked, not public. Hash observed at WP0; identity with the file as written in Phase 1 is NOT_PROVEN."
    },
    {
      "source_id": "p1-rev2-evidence-index",
      "kind": "phase1_decision_record",
      "path": ".agents/tasks/phase1/final-acceptance/rev2/phase1-evidence-index.md",
      "section": null,
      "coverage": null,
      "commit": null,
      "verified_commits": [],
      "blob_ids": {},
      "sha256_at_wp0": "07216f600b938d5e39936d073da402ebfa914c5b495887f89bd3bb7c4b76520d",
      "public": false,
      "note": "Phase 1 Evidence Index rev2 (E01-E40, H01-H03). Local, not public."
    },
    {
      "source_id": "p1-rev3-traceability",
      "kind": "phase1_decision_record",
      "path": ".agents/tasks/phase1/final-acceptance/rev3/phase1-ac-traceability.rev3.json",
      "section": null,
      "coverage": null,
      "commit": null,
      "verified_commits": [],
      "blob_ids": {},
      "sha256_at_wp0": "52b3f803f7c0b7d37510c30885be1aa9c6ea227b6b7df907caaaa0e7274d4139",
      "public": false,
      "note": "AC Traceability rev3 (48 ACs; AC27 split into axes). Local, not public."
    },
    {
      "source_id": "p1-rev3-finalization",
      "kind": "phase1_decision_record",
      "path": ".agents/tasks/phase1/final-acceptance/rev3/phase1-evidence-finalization.md",
      "section": null,
      "coverage": null,
      "commit": null,
      "verified_commits": [],
      "blob_ids": {},
      "sha256_at_wp0": "bc6d47206469f7c1ae17a6dde3536f446fd57e40db80254624764cd4a1b1a522",
      "public": false,
      "note": "Phase 1 evidence finalization rev3. Local, not public."
    },
    {
      "source_id": "p1-rev3-handoff",
      "kind": "phase1_decision_record",
      "path": ".agents/tasks/phase1/final-acceptance/rev3/phase2-handoff.md",
      "section": null,
      "coverage": null,
      "commit": null,
      "verified_commits": [],
      "blob_ids": {},
      "sha256_at_wp0": "fe095ad2e851b0f372fc72d87081511b8e17dc055680bcfab69f46b3eae4f56c",
      "public": false,
      "note": "Phase 2 handoff (P1, P2). Local, not public."
    },
    {
      "source_id": "p2-wp0-alignment-audit",
      "kind": "phase2_document",
      "path": "docs/v2/phase2/m1/wp0/acceptance-alignment-audit.md",
      "section": null,
      "coverage": null,
      "commit": null,
      "verified_commits": [],
      "blob_ids": {},
      "sha256_at_wp0": "911317ea2138e5f9d666a9901544d460b55f8f298ed9c1e7bede02b0ce6ed1f3",
      "public": true,
      "note": "Phase 2 WP0 audit (S7-xx clause ids, helper alignment). Written in Phase 2; not committed when this Definition was created."
    },
    {
      "source_id": "p2-wp0-architecture",
      "kind": "phase2_document",
      "path": "docs/v2/phase2/m1/wp0/m1-architecture-proposal.md",
      "section": null,
      "coverage": null,
      "commit": null,
      "verified_commits": [],
      "blob_ids": {},
      "sha256_at_wp0": "afd3a97158755e3eb9d383774cfeed238e9c6605c633a1ec5284717744731b0e",
      "public": true,
      "note": "Phase 2 WP0 architecture proposal (artifact integrity, axes). Not committed when this Definition was created."
    }
  ],
  "historical_evaluator": {
    "helper_path": ".agents/tasks/phase1/henv/phase1_appdemo.py",
    "public": false,
    "sha256_at_wp0": "493177b44f488f96cf54f1aa02d9dedda9a5310cbac6cd61a236e0a8083228bf",
    "version_at_evidence_time": "UNKNOWN",
    "reason": "The helper was never under version control and no evidence file records the helper version or hash. Its mtime (2026-10-28T15:40+09:00) is later than E18 (13:55+09:00). The WP0 hash identifies the file as read in WP0 only."
  },
  "phase1_locked_classifications": [
    {
      "subject": "G3",
      "axis": "required_check",
      "status": "FAILED",
      "basis_source_id": "p1-rev2-summary",
      "basis": "rev2 §3-1 / C1; rev3 AC27 axis s7_required_isRequired_criterion"
    },
    {
      "subject": "G3S",
      "axis": "required_check",
      "status": "FAILED",
      "basis_source_id": "p1-rev2-summary",
      "basis": "rev2 §3-1 / C1; rev3 AC27 axis s7_required_isRequired_criterion"
    },
    {
      "subject": "G6",
      "axis": "required_check",
      "status": "FAILED",
      "basis_source_id": "p1-rev2-summary",
      "basis": "rev2 §3-1 / C1; rev3 AC27 axis s7_required_isRequired_criterion"
    },
    {
      "subject": "G3",
      "axis": "merge_blocking",
      "status": "PASS",
      "basis_source_id": "p1-rev2-summary",
      "basis": "rev2 §3-1 merge blocking row; rev3 AC27 axis merge_blocked_by_gate_failure"
    },
    {
      "subject": "G3S",
      "axis": "merge_blocking",
      "status": "PASS",
      "basis_source_id": "p1-rev2-summary",
      "basis": "rev2 §3-1 merge blocking row; rev3 AC27 axis merge_blocked_by_gate_failure"
    },
    {
      "subject": "G6",
      "axis": "merge_blocking",
      "status": "PASS",
      "basis_source_id": "p1-rev2-summary",
      "basis": "rev2 §3-1 merge blocking row; rev3 AC27 axis merge_blocked_by_gate_failure"
    },
    {
      "subject": "G3",
      "axis": "issuer_pinning_independent_proof",
      "status": "NOT_PROVEN",
      "basis_source_id": "p1-rev2-summary",
      "basis": "rev2 §3-1, §3-2; rev3 AC27 axis issuer_pinning_independent_proof"
    },
    {
      "subject": "G3S",
      "axis": "issuer_pinning_independent_proof",
      "status": "NOT_PROVEN",
      "basis_source_id": "p1-rev2-summary",
      "basis": "rev2 §3-1, §3-2; rev3 AC27 axis issuer_pinning_independent_proof"
    },
    {
      "subject": "G6",
      "axis": "issuer_pinning_independent_proof",
      "status": "NOT_PROVEN",
      "basis_source_id": "p1-rev2-summary",
      "basis": "rev2 §3-1, §3-2; rev3 AC27 axis issuer_pinning_independent_proof"
    }
  ],
  "phase1_final_results": {
    "scenarios": {
      "G0": "PASS",
      "G1": "PASS",
      "G2": "PASS",
      "G4": "PASS",
      "G5": "PASS",
      "G9": "PASS",
      "G10": "PASS",
      "G11b": "PASS",
      "G3": "FAILED",
      "G3S": "FAILED",
      "G6": "FAILED",
      "G12": "PARTIAL",
      "G7": "NOT_PROVEN",
      "G8": "NOT_PROVEN",